{
  "schemaVersion": "0.1.0",
  "game": "Arknights: Endfield",
  "lastReviewedAt": "2026-06-10",
  "sources": [
    {
      "id": "namu-weapon-main",
      "title": "명일방주: 엔드필드/무기",
      "url": "https://namu.wiki/w/%EB%AA%85%EC%9D%BC%EB%B0%A9%EC%A3%BC%3A%20%EC%97%94%EB%93%9C%ED%95%84%EB%93%9C%2F%EB%AC%B4%EA%B8%B0",
      "type": "wiki",
      "language": "ko",
      "lastCheckedAt": "2026-06-10",
      "notes": "무기 공통 규칙, 레어도, 유형, 육성, 잠재능력, 기질, 기질 식각 기준 출처."
    },
    {
      "id": "namu-weapon-sword",
      "title": "명일방주: 엔드필드/무기/한손검",
      "url": "https://namu.wiki/w/%EB%AA%85%EC%9D%BC%EB%B0%A9%EC%A3%BC%3A%20%EC%97%94%EB%93%9C%ED%95%84%EB%93%9C%2F%EB%AC%B4%EA%B8%B0%2F%ED%95%9C%EC%86%90%EA%B2%80",
      "type": "wiki",
      "language": "ko",
      "lastCheckedAt": "2026-06-10",
      "notes": "한손검 Sword 무기 목록과 기초 수치 출처."
    },
    {
      "id": "namu-weapon-greatsword",
      "title": "명일방주: 엔드필드/무기/양손검",
      "url": "https://namu.wiki/w/%EB%AA%85%EC%9D%BC%EB%B0%A9%EC%A3%BC%3A%20%EC%97%94%EB%93%9C%ED%95%84%EB%93%9C%2F%EB%AC%B4%EA%B8%B0%2F%EC%96%91%EC%86%90%EA%B2%80",
      "type": "wiki",
      "language": "ko",
      "lastCheckedAt": "2026-06-10",
      "notes": "양손검 Great Sword 무기 목록과 기초 수치 출처."
    },
    {
      "id": "namu-weapon-polearm",
      "title": "명일방주: 엔드필드/무기/장병기",
      "url": "https://namu.wiki/w/%EB%AA%85%EC%9D%BC%EB%B0%A9%EC%A3%BC%3A%20%EC%97%94%EB%93%9C%ED%95%84%EB%93%9C%2F%EB%AC%B4%EA%B8%B0%2F%EC%9E%A5%EB%B3%91%EA%B8%B0",
      "type": "wiki",
      "language": "ko",
      "lastCheckedAt": "2026-06-10",
      "notes": "장병기 Polearm 무기 목록과 기초 수치 출처."
    },
    {
      "id": "namu-weapon-handcannon",
      "title": "명일방주: 엔드필드/무기/권총",
      "url": "https://namu.wiki/w/%EB%AA%85%EC%9D%BC%EB%B0%A9%EC%A3%BC%3A%20%EC%97%94%EB%93%9C%ED%95%84%EB%93%9C%2F%EB%AC%B4%EA%B8%B0%2F%EA%B6%8C%EC%B4%9D",
      "type": "wiki",
      "language": "ko",
      "lastCheckedAt": "2026-06-10",
      "notes": "권총 Handcannon 무기 목록과 기초 수치 출처."
    },
    {
      "id": "namu-weapon-arts-unit",
      "title": "명일방주: 엔드필드/무기/아츠 유닛",
      "url": "https://namu.wiki/w/%EB%AA%85%EC%9D%BC%EB%B0%A9%EC%A3%BC%3A%20%EC%97%94%EB%93%9C%ED%95%84%EB%93%9C%2F%EB%AC%B4%EA%B8%B0%2F%EC%95%84%EC%B8%A0%20%EC%9C%A0%EB%8B%9B",
      "type": "wiki",
      "language": "ko",
      "lastCheckedAt": "2026-06-10",
      "notes": "아츠 유닛 Arts Unit 무기 목록과 기초 수치 출처."
    }
  ],
  "categories": [
    {
      "id": "weapon-option-0a46011b",
      "kind": "stat",
      "nameKo": "주요 능력치 증가 · 대",
      "statKo": "주요 능력치",
      "range": {
        "min": "+17",
        "max": "+132",
        "raw": [
          "+17",
          "+30",
          "+44",
          "+57",
          "+71",
          "+85",
          "+98",
          "+112",
          "+132"
        ]
      }
    },
    {
      "id": "weapon-option-76a6fc5c",
      "kind": "stat",
      "nameKo": "오리지늄 아츠 강도 증가 · 대",
      "statKo": "오리지늄 아츠 강도",
      "range": {
        "min": "+10",
        "max": "+78",
        "raw": [
          "+10",
          "+18",
          "+26",
          "+34",
          "+42",
          "+50",
          "+58",
          "+66",
          "+78"
        ]
      }
    },
    {
      "id": "weapon-option-400b977e",
      "kind": "weaponSkill",
      "nameKo": "고통 · 백야의 별",
      "statKo": "아츠 피해",
      "range": {
        "min": "+12%",
        "max": "+33.6%",
        "raw": [
          "+12%",
          "+14.4%",
          "+16.8%",
          "+19.2%",
          "+21.6%",
          "+24%",
          "+26.4%",
          "+28.8%",
          "+33.6%"
        ]
      },
      "essenceCategoryId": "essence-pain"
    },
    {
      "id": "weapon-option-7ee29127",
      "kind": "stat",
      "nameKo": "물리 피해 증가 · 대",
      "statKo": "물리 피해",
      "range": {
        "min": "+5.56%",
        "max": "+43.33%",
        "raw": [
          "+5.56%",
          "+10%",
          "+14.44%",
          "+18.89%",
          "+23.33%",
          "+27.78%",
          "+32.22%",
          "+36.67%",
          "+43.33%"
        ]
      }
    },
    {
      "id": "weapon-option-0bbc83c4",
      "kind": "weaponSkill",
      "nameKo": "잔혹 · 엄격한 규율",
      "statKo": "공격력",
      "range": {
        "min": "+10%",
        "max": "+28%",
        "raw": [
          "+10%",
          "+12%",
          "+14%",
          "+16%",
          "+18%",
          "+20%",
          "+22%",
          "+24%",
          "+28%"
        ]
      },
      "essenceCategoryId": "essence-cruelty"
    },
    {
      "id": "weapon-option-945fd3bb",
      "kind": "stat",
      "nameKo": "의지 증가 · 대",
      "statKo": "의지",
      "range": {
        "min": "+20",
        "max": "+156",
        "raw": [
          "+20",
          "+36",
          "+52",
          "+68",
          "+84",
          "+100",
          "+116",
          "+132",
          "+156"
        ]
      }
    },
    {
      "id": "weapon-option-8ca88f67",
      "kind": "stat",
      "nameKo": "공격력 증가 · 대",
      "statKo": "공격력",
      "range": {
        "min": "+5%",
        "max": "+39%",
        "raw": [
          "+5%",
          "+9%",
          "+13%",
          "+17%",
          "+21%",
          "+25%",
          "+29%",
          "+33%",
          "+39%"
        ]
      }
    },
    {
      "id": "weapon-option-025c82a1",
      "kind": "weaponSkill",
      "nameKo": "흐름 · 고열 방출",
      "statKo": "공격력",
      "range": {
        "min": "+10%",
        "max": "+28%",
        "raw": [
          "+10%",
          "+12%",
          "+14%",
          "+16%",
          "+18%",
          "+20%",
          "+22%",
          "+24%",
          "+28%"
        ]
      },
      "essenceCategoryId": "essence-flow"
    },
    {
      "id": "weapon-option-f3a7b3d4",
      "kind": "stat",
      "nameKo": "치명타 확률 증가 · 대",
      "statKo": "치명타 확률",
      "range": {
        "min": "+2.5%",
        "max": "+19.5%",
        "raw": [
          "+2.5%",
          "+4.5%",
          "+6.5%",
          "+8.5%",
          "+10.5%",
          "+12.5%",
          "+14.5%",
          "+16.5%",
          "+19.5%"
        ]
      }
    },
    {
      "id": "weapon-option-71490fb5",
      "kind": "weaponSkill",
      "nameKo": "어둠 · 청운",
      "statKo": "배틀 스킬과 궁극기가 주는 물리 피해",
      "range": {
        "min": "+15%",
        "max": "+42%",
        "raw": [
          "+15%",
          "+18%",
          "+21%",
          "+24%",
          "+27%",
          "+30%",
          "+33%",
          "+36%",
          "+42%"
        ]
      },
      "essenceCategoryId": "essence-darkness"
    },
    {
      "id": "weapon-option-66a25e14",
      "kind": "weaponSkill",
      "nameKo": "흐름 · 윤회",
      "statKo": "물리 피해",
      "range": {
        "min": "+16%",
        "max": "+44.8%",
        "raw": [
          "+16%",
          "+19.2%",
          "+22.4%",
          "+25.6%",
          "+28.8%",
          "+32%",
          "+35.2%",
          "+38.4%",
          "+44.8%"
        ]
      },
      "essenceCategoryId": "essence-flow"
    },
    {
      "id": "weapon-option-c8c4e851",
      "kind": "stat",
      "nameKo": "민첩 증가 · 대",
      "statKo": "민첩",
      "range": {
        "min": "+20",
        "max": "+156",
        "raw": [
          "+20",
          "+36",
          "+52",
          "+68",
          "+84",
          "+100",
          "+116",
          "+132",
          "+156"
        ]
      }
    },
    {
      "id": "weapon-option-91e7fab0",
      "kind": "weaponSkill",
      "nameKo": "고통 · 간절한 소망",
      "statKo": "오리지늄 아츠 강도",
      "range": {
        "min": "+30",
        "max": "+84",
        "raw": [
          "+30",
          "+36",
          "+42",
          "+48",
          "+54",
          "+60",
          "+66",
          "+72",
          "+84"
        ]
      },
      "essenceCategoryId": "essence-pain"
    },
    {
      "id": "weapon-option-ba8f8c29",
      "kind": "stat",
      "nameKo": "지능 증가 · 대",
      "statKo": "지능",
      "range": {
        "min": "+20",
        "max": "+156",
        "raw": [
          "+20",
          "+36",
          "+52",
          "+68",
          "+84",
          "+100",
          "+116",
          "+132",
          "+156"
        ]
      }
    },
    {
      "id": "weapon-option-ecb85f90",
      "kind": "weaponSkill",
      "nameKo": "어둠 · 울부짖는 불길",
      "statKo": "열기 피해",
      "range": {
        "min": "+16%",
        "max": "+44.8%",
        "raw": [
          "+16%",
          "+19.2%",
          "+22.4%",
          "+25.6%",
          "+28.8%",
          "+32%",
          "+35.2%",
          "+38.4%",
          "+44.8%"
        ]
      },
      "essenceCategoryId": "essence-darkness"
    },
    {
      "id": "weapon-option-8f154f33",
      "kind": "weaponSkill",
      "nameKo": "골절 · 군랑의 포식",
      "statKo": "공격력",
      "range": {
        "min": "+16%",
        "max": "+44.8%",
        "raw": [
          "+16%",
          "+19.2%",
          "+22.4%",
          "+25.6%",
          "+28.8%",
          "+32%",
          "+35.2%",
          "+38.4%",
          "+44.8%"
        ]
      },
      "essenceCategoryId": "essence-fracture"
    },
    {
      "id": "weapon-option-762aa07f",
      "kind": "stat",
      "nameKo": "열기 피해 증가 · 대",
      "statKo": "열기 피해",
      "range": {
        "min": "+5.56%",
        "max": "+43.33%",
        "raw": [
          "+5.56%",
          "+10%",
          "+14.44%",
          "+18.89%",
          "+23.33%",
          "+27.78%",
          "+32.22%",
          "+36.67%",
          "+43.33%"
        ]
      }
    },
    {
      "id": "weapon-option-fb87299d",
      "kind": "weaponSkill",
      "nameKo": "고통 · 쌓이는 탐욕",
      "statKo": "공격력",
      "range": {
        "min": "+7%",
        "max": "+19.6%",
        "raw": [
          "+7%",
          "+8.4%",
          "+9.8%",
          "+11.2%",
          "+12.6%",
          "+14%",
          "+15.4%",
          "+16.8%",
          "+19.6%"
        ]
      },
      "essenceCategoryId": "essence-pain"
    },
    {